url,content,company_name,date,Sentiment
https://www.msn.com/en-us/money/technology/elon-musk-sues-indian-battery-company-tesla-power-for-trademark-infringement/ar-AA1o7dhy,"Elon Musk sues Indian battery company Tesla Power for trademark infringement. Elon Musk's Tesla, Inc., has sued an India company called Tesla Power India in the Delhi High Court, alleging copyright infringement. ",Tesla,5/4/2024,"{""layoffs"": null, ""restructuring"": null, ""board_changes"": null, ""mergers"": null, ""investor_activity"": null, ""esg"": null, ""revenue_growth"": null, ""product_launches"": null, ""expansion"": null, ""disputes"": -1.0, ""geo_political"": null, ""macro_economic"": null, ""partnerships"": null, ""cyber_security"": null, ""supply_chain"": null, ""labor_issues"": null, ""product_recalls"": null, ""overall_sentiment"": -0.5}"
https://www.msn.com/en-us/money/topstocks/this-is-huge-news-for-tesla-stock-investors/ar-AA1o1Ghk,"This Is Huge News for Tesla Stock Investors. Tesla is making big strides in autonomous driving around the globe. One company that constantly finds its name in the spotlight is Tesla ( TSLA 0.01%). The company's CEO, entrepreneur Elon Musk, is equal parts entertaining and, at times, pretty jarring. ",Tesla,5/2/2024,"{""layoffs"": null, ""restructuring"": null, ""board_changes"": null, ""mergers"": null, ""investor_activity"": null, ""esg"": null, ""revenue_growth"": null, ""product_launches"": 0.5, ""expansion"": null, ""disputes"": null, ""geo_political"": null, ""macro_economic"": null, ""partnerships"": null, ""cyber_security"": null, ""supply_chain"": null, ""labor_issues"": null, ""product_recalls"": null, ""overall_sentiment"": 0.5}"
https://www.msn.com/en-us/money/companies/tesla-is-pulling-back-from-ev-charging-and-people-are-freaking-out/ar-AA1nZx5G,"Tesla Is Pulling Back From EV Charging, and People Are Freaking Out. Widespread layoffs within the Tesla unit are a blow to efforts to build out a national charging network. ",Tesla,5/3/2024,"{""layoffs"": -1.0, ""restructuring"": null, ""board_changes"": null, ""mergers"": null, ""investor_activity"": null, ""esg"": null, ""revenue_growth"": null, ""product_launches"": null, ""expansion"": null, ""disputes"": null, ""geo_political"": null, ""macro_economic"": null, ""partnerships"": null, ""cyber_security"": null, ""supply_chain"": null, ""labor_issues"": -1.0, ""product_recalls"": null, ""overall_sentiment"": -1.0}"
https://observer.com/2024/05/elon-musk-tesla-turnaround-plan/,"Elon Musk's Tesla Turnaround Plan, Explained. Layoffs and resignations are rattling all levels of positions at Tesla. In an email on Monday (April 29), first reported by the Information, Musk announced that two senior Tesla executives —Rebecca Tinucci, senior director for charging infrastructure ... ",Tesla,5/2/2024,"{""layoffs"": -0.8, ""restructuring"": -0.7, ""board_changes"": -0.6, ""mergers"": null, ""investor_activity"": null, ""esg"": null, ""revenue_growth"": null, ""product_launches"": null, ""expansion"": null, ""disputes"": null, ""geo_political"": null, ""macro_economic"": null, ""partnerships"": null, ""cyber_security"": null, ""supply_chain"": null, ""labor_issues"": -0.8, ""product_recalls"": null, ""overall_sentiment"": -0.7}"
https://www.inc.com/reuters/tesla-v-tesla.html,"Tesla v. Tesla?. There won't be any Academy Award nominations for this court case in Delhi, where the EV maker is suing an Indian battery maker for using its trademark. inc.com",Tesla,5/3/2024,"{""layoffs"": null, ""restructuring"": null, ""board_changes"": null, ""mergers"": null, ""investor_activity"": null, ""esg"": null, ""revenue_growth"": null, ""product_launches"": null, ""expansion"": null, ""disputes"": -1.0, ""geo_political"": null, ""macro_economic"": null, ""partnerships"": null, ""cyber_security"": null, ""supply_chain"": null, ""labor_issues"": null, ""product_recalls"": null, ""overall_sentiment"": -0.5}"
